{
  "format": "llm-foundations-model-profile-v1",
  "model_profile_id": "smollm2-135m-instruct-v1",
  "repository": "HuggingFaceTB/SmolLM2-135M-Instruct",
  "revision": "12fd25f77366fa6b3b4b768ec3050bf629380bac",
  "license": "Apache-2.0",
  "download_manifest_sha256": "4ac640c0c740b5294fbcc1bfe0d74a4667262c98c63ac65d456d12a0648cda0a",
  "tokenizer_sha256": "9ca9acddb6525a194ec8ac7a87f24fbba7232a9a15ffa1af0c1224fcd888e47c",
  "chat_template_sha256": "872be49dbb638044ad01b60388f48d469ff2980e5f0dccdc22ec907db54d0788",
  "architecture": {
    "class": "LlamaForCausalLM",
    "model_type": "llama",
    "layers": 30,
    "hidden_size": 576,
    "intermediate_size": 1536,
    "attention_heads": 9,
    "key_value_heads": 3,
    "head_dimension": 64,
    "vocabulary_size": 49152,
    "native_context": 8192,
    "rope_theta": 100000,
    "tie_word_embeddings": true
  },
  "tokens": {"bos": 1, "eos": 2, "pad": 2},
  "execution": {
    "teaching_context": 512,
    "source_dtype_metadata": "bfloat16",
    "dtype": "float32",
    "quantization": "none",
    "trust_remote_code": false,
    "use_safetensors": true,
    "default_device": "cpu"
  },
  "adapter_preset": {
    "preset_id": "smollm2-intents-lora-v1",
    "r": 8,
    "lora_alpha": 16,
    "lora_dropout": 0,
    "bias": "none",
    "task_type": "CAUSAL_LM",
    "target_modules": ["q_proj", "v_proj"],
    "trainable_parameters": 460800,
    "batch_size": 1,
    "gradient_accumulation": 4,
    "learning_rate": 0.001,
    "weight_decay": 0.01,
    "adam_beta1": 0.9,
    "adam_beta2": 0.999,
    "adam_epsilon": 1e-8,
    "max_gradient_norm": 1,
    "validation_every_updates": 10,
    "checkpoint_every_updates": 10,
    "maximum_lineage_updates": 120
  },
  "capstone_adapter_preset": {
    "preset_id": "smollm2-capstone-lora-v1",
    "dataset_fixture_id": "capstone-support-v1",
    "r": 8,
    "lora_alpha": 16,
    "lora_dropout": 0,
    "bias": "none",
    "task_type": "CAUSAL_LM",
    "target_modules": ["q_proj", "v_proj"],
    "trainable_parameters": 460800,
    "batch_size": 1,
    "gradient_accumulation": 3,
    "learning_rate": 0.001,
    "weight_decay": 0.01,
    "adam_beta1": 0.9,
    "adam_beta2": 0.999,
    "adam_epsilon": 1e-8,
    "max_gradient_norm": 1,
    "seed": 29,
    "required_updates": 20,
    "validation_every_updates": 5,
    "checkpoint_every_updates": 5,
    "maximum_lineage_updates": 20
  }
}
